{
  "run_id": "meta:conservative:d39a1fa64d518d8aa1e723f1e7ad1f4931340deebf5b98bc37713cb998350cc4",
  "modules": [
    {
      "id": "worktree.manager",
      "version": "0.1.0"
    },
    {
      "id": "safety.validation",
      "version": "0.1.0"
    },
    {
      "id": "git.diff.core",
      "version": "0.1.0"
    },
    {
      "id": "git.index.controller",
      "version": "0.1.0"
    }
  ],
  "wiring": [],
  "glue": [],
  "constraints": [
    "no-cross-imports",
    "ports-only-coupling"
  ]
}