{
  "run_id": "2025-10-12T15:42:05.765Z",
  "modules": [
    {
      "id": "git.diff.core",
      "version": "0.1.0"
    },
    {
      "id": "git.index.controller",
      "version": "0.1.0"
    },
    {
      "id": "safety.validation",
      "version": "0.1.0"
    }
  ],
  "wiring": [],
  "glue": [],
  "constraints": [
    "no-cross-imports",
    "ports-only-coupling"
  ]
}